{
  "$ref": "#/definitions/attribution-history-snapshot",
  "definitions": {
    "attribution-history-snapshot": {
      "type": "object",
      "properties": {
        "schema_version": {
          "type": "number",
          "const": 1
        },
        "snapshot_date": {
          "type": "string"
        },
        "generated_at": {
          "type": "string"
        },
        "source_ledger_updated_at": {
          "type": "string"
        },
        "total_attributed_fetches": {
          "type": "number"
        },
        "net_attributed_fetches": {
          "type": "number"
        },
        "daily_attributed_fetches": {
          "type": "number"
        },
        "assets_daily": {
          "type": "object",
          "additionalProperties": {
            "type": "number"
          }
        }
      },
      "required": [
        "schema_version",
        "snapshot_date",
        "generated_at",
        "source_ledger_updated_at",
        "total_attributed_fetches",
        "net_attributed_fetches",
        "daily_attributed_fetches",
        "assets_daily"
      ],
      "additionalProperties": false
    }
  },
  "$schema": "http://json-schema.org/draft-07/schema#"
}
