{
  "schema_version": 1,
  "snapshot_date": "2026_10_13",
  "generated_at": "2026-10-13T04:03:16.723Z",
  "source_ledger_updated_at": "2026-10-13T02:07:26.857Z",
  "total_attributed_fetches": 23967,
  "net_attributed_fetches": 6,
  "daily_attributed_fetches": 2,
  "assets_daily": {
    "worstboyinaustral1a/subway-builder-za@cpt-1.0.2/cpt_v1.0.2.zip#RA_kwDOTRwM6c4dF0ps": 2
  }
}
