{
  "schema_version": 1,
  "snapshot_date": "2026_03_29",
  "generated_at": "2026-03-29T04:00:00.000Z",
  "source_ledger_updated_at": "2026-05-24T02:54:12.621Z",
  "total_attributed_fetches": 3920,
  "net_attributed_fetches": 2,
  "daily_attributed_fetches": 1,
  "assets_daily": {
    "valdotorium/valdotoriums_trains@v0.1.4/valdotoriums_trains_0_1_4.zip": 1
  }
}
