{
  "schema_version": 1,
  "snapshot_date": "2026_07_10",
  "generated_at": "2026-07-10T04:01:41.707Z",
  "source_ledger_updated_at": "2026-07-10T00:04:04.341Z",
  "total_attributed_fetches": 9374,
  "net_attributed_fetches": 112,
  "daily_attributed_fetches": 6,
  "assets_daily": {
    "kronifer/sb-chinese-maps@v1.7.0/can.zip": 1,
    "kronifer/sb-chinese-maps@v1.7.0/ckg.zip": 1,
    "kronifer/sb-chinese-maps@v1.7.0/pek.zip": 1,
    "kronifer/sb-chinese-maps@v1.7.0/sha.zip": 1,
    "kronifer/sb-chinese-maps@v1.7.0/szx.zip": 1,
    "nerdiesanders/subway-builder-gchi@v1.3.0/gchi.zip#RA_kwDOTEOQ_84b8KMm": 1
  }
}
