{
  "schema_version": 1,
  "snapshot_date": "2026_03_30",
  "generated_at": "2026-03-30T04:00:00.000Z",
  "source_ledger_updated_at": "2026-05-24T02:54:12.621Z",
  "total_attributed_fetches": 4441,
  "net_attributed_fetches": 521,
  "daily_attributed_fetches": 43,
  "assets_daily": {
    "ahkimn/subwaybuilder-regions@v0.4.5/subwaybuilder-regions-v0.4.5.zip": 1,
    "barkuperman/transit-overlay-subway-builder-mod@1.5.0/transit-overlay.zip": 1,
    "crumpetime/subway_builder_distance_circles@0.3.3/distancecircles.zip": 1,
    "crumpetime/subway_builder_distance_circles@0.4.0/distancecircles.zip": 1,
    "danield1909/dantrains@v1.0.0/dantrains-1_0_0-phoenix.zip": 1,
    "danield1909/dantrains@v1.0.1/dantrains-1_0_1-phoenix.zip": 1,
    "danield1909/dantrains@v1.0.2/dantrains-1_0_2-phoenix.zip": 1,
    "danield1909/dantrains@v1.0.3/dantrains-1_0_3-phoenix.zip": 1,
    "danield1909/dantrains@v1.1.0/dantrains-1_1_0-phoenix.zip": 1,
    "danield1909/dantrains@v1.1.1/dantrains-1_1_1-phoenix.zip": 1,
    "danield1909/dantrains@v1.1.2/dantrains-1_1_2-phoenix.zip": 1,
    "danield1909/dantrains@v1.2.0/dantrains-1_2_0-phoenix.zip": 1,
    "danield1909/dantrains@v1.2.1/dantrains-1_2_1-phoenix.zip": 1,
    "danield1909/dantrains@v1.3.0/dantrains-1_3_0-phoenix.zip": 1,
    "gio1112/subway-builder-citymapper@0.1.0/citymapper.zip": 1,
    "gio1112/subway-builder-citymapper@0.1.2/citymapper.zip": 1,
    "nzh0172/sb-anymoney@v0.1.0/v0.1.0.zip": 1,
    "nzh0172/sb-anymoney@v0.1.1/v0.1.1.zip": 1,
    "nzh0172/sb-anymoney@v0.2.0/v0.2.0.zip": 1,
    "pswbsf/wilmington-nc@v1.0.0/wilmington.zip": 2,
    "stefanorigano/advanced_analytics@v0.9.1/advanced_analytics-v0.9.1.zip": 1,
    "stefanorigano/advanced_analytics@v0.9.2/advanced_analytics-v0.9.2.zip": 1,
    "stefanorigano/advanced_analytics@v1.0.0/advanced_analytics-v1.0.0.zip": 1,
    "stefanorigano/advanced_analytics@v1.0.1/advanced_analytics-v1.0.1.zip": 1,
    "stefanorigano/advanced_analytics@v1.1.0/advanced_analytics-v1.1.0.zip": 1,
    "stefanorigano/advanced_analytics@v1.2.0/advanced_analytics-v1.2.0.zip": 1,
    "stefanorigano/advanced_analytics@v1.2.1/advanced_analytics-v1.2.1.zip": 1,
    "stefanorigano/advanced_analytics@v1.2.5/advanced_analytics-v1.2.5.zip": 1,
    "stefanorigano/advanced_analytics@v1.2.6/advanced_analytics-v1.2.6.zip": 1,
    "stefanorigano/advanced_analytics@v1.2.7/advanced_analytics-v1.2.7.zip": 1,
    "stefanorigano/advanced_analytics@v1.2.8/advanced_analytics-v1.2.8.zip": 1,
    "stefanorigano/advanced_analytics@v1.2.9/advanced_analytics-v1.2.9.zip": 1,
    "stefanorigano/advanced_analytics@v1.3.0/advanced_analytics-v1.3.0.zip": 1,
    "subway-builder-modded/dependency-test-mod@v0.1.3/mod-base.zip": 1,
    "subway-builder-modded/dependency-test-mod@v0.1.3/mod-nested.zip": 1,
    "subway-builder-modded/test-mod-vulnerabilityscanning@v0.1.0/evil.zip": 1,
    "transitcore/cinematic-camera@v1.0.0/cinematic-camera.zip": 1,
    "transitcore/cinematic-camera@v1.1.0/cinematic-camera.zip": 1,
    "transitcore/cinematic-camera@v1.2.0/cinematic-camera.zip": 1,
    "valdotorium/valdotoriums_trains@v0.1.2/valdotoriums_trains_0_1_2.zip": 1,
    "valdotorium/valdotoriums_trains@v0.1.3/valdotoriums_trains_0_1_3.zip": 1,
    "valdotorium/valdotoriums_trains@v0.1.4/valdotoriums_trains_0_1_4.zip": 1
  }
}
