{
  "schema_version": 1,
  "snapshot_date": "2026_05_09",
  "generated_at": "2026-05-09T04:04:07.349Z",
  "source_ledger_updated_at": "2026-05-09T03:49:58.039Z",
  "total_attributed_fetches": 5925,
  "net_attributed_fetches": 4,
  "daily_attributed_fetches": 2,
  "assets_daily": {
    "kronifer/sb-chinese-maps@v1.2.0/can.zip": 1,
    "kronifer/sb-chinese-maps@v1.2.0/can.zip#RA_kwDOSMl09c4YyDbI": 1
  }
}
