{
  "schema_version": 1,
  "snapshot_date": "2026_05_24",
  "generated_at": "2026-05-24T04:48:41.595Z",
  "source_ledger_updated_at": "2026-05-24T04:12:54.691Z",
  "total_attributed_fetches": 6717,
  "net_attributed_fetches": 677,
  "daily_attributed_fetches": 2,
  "assets_daily": {
    "hsullivan1201/sb-tod@v0.2.2/sb-tod-v0.2.2.zip#RA_kwDOSJ7lIs4Zho_-": 1,
    "hsullivan1201/sb-tod@v0.2.3/sb-tod-v0.2.3.zip#RA_kwDOSJ7lIs4ZhtpJ": 1
  }
}
