{
  "schema_version": 1,
  "snapshot_date": "2026_06_25",
  "generated_at": "2026-06-25T08:05:29.334Z",
  "source_ledger_updated_at": "2026-06-25T05:22:45.997Z",
  "total_attributed_fetches": 7563,
  "net_attributed_fetches": 1,
  "daily_attributed_fetches": 1,
  "assets_daily": {
    "kaicardenas0618/japanese-trains@v1.1.1/japanese-trains-v1.1.1.zip#RA_kwDOSzb2_M4bQj14": 1
  }
}
