{
  "schema_version": 1,
  "snapshot_date": "2026_04_18",
  "generated_at": "2026-04-18T04:00:00.000Z",
  "source_ledger_updated_at": "2026-05-24T02:54:12.621Z",
  "total_attributed_fetches": 5719,
  "net_attributed_fetches": 12,
  "daily_attributed_fetches": 10,
  "assets_daily": {
    "ahkimn/subwaybuilder-jp-maps@0.3.7/kcz.zip": 1,
    "ahkimn/subwaybuilder-jp-maps@0.3.7/kcz.zip#RA_kwDORgfqUM4Xyb7k": 1,
    "ahkimn/subwaybuilder-jp-maps@0.3.7/myj.zip": 1,
    "ahkimn/subwaybuilder-jp-maps@0.3.7/myj.zip#RA_kwDORgfqUM4Xyb8l": 1,
    "ahkimn/subwaybuilder-jp-maps@0.3.7/oka.zip": 1,
    "ahkimn/subwaybuilder-jp-maps@0.3.7/oka.zip#RA_kwDORgfqUM4Xyb94": 1,
    "ahkimn/subwaybuilder-jp-maps@0.3.7/spk.zip": 1,
    "ahkimn/subwaybuilder-jp-maps@0.3.7/spk.zip#RA_kwDORgfqUM4XycAL": 1,
    "ahkimn/subwaybuilder-jp-maps@0.3.7/uky.zip": 1,
    "ahkimn/subwaybuilder-jp-maps@0.3.7/uky.zip#RA_kwDORgfqUM4XycMe": 1
  }
}
