{
  "schema_version": 1,
  "snapshot_date": "2026_06_02",
  "generated_at": "2026-06-02T05:13:01.624Z",
  "source_ledger_updated_at": "2026-06-02T04:44:11.414Z",
  "total_attributed_fetches": 6821,
  "net_attributed_fetches": 55,
  "daily_attributed_fetches": 19,
  "assets_daily": {
    "kaicardenas0618/subway-builder-peru@1.1.0/aqp.zip": 1,
    "kaicardenas0618/subway-builder-peru@1.1.0/aqp.zip#RA_kwDOStO8Y84Z-jjD": 1,
    "kaicardenas0618/subway-builder-peru@1.1.0/chm.zip": 1,
    "kaicardenas0618/subway-builder-peru@1.1.0/chm.zip#RA_kwDOStO8Y84Z-jje": 1,
    "kaicardenas0618/subway-builder-peru@1.1.0/cix.zip": 1,
    "kaicardenas0618/subway-builder-peru@1.1.0/cix.zip#RA_kwDOStO8Y84Z-jj6": 1,
    "kaicardenas0618/subway-builder-peru@1.1.0/cuz.zip": 1,
    "kaicardenas0618/subway-builder-peru@1.1.0/cuz.zip#RA_kwDOStO8Y84Z-jkd": 1,
    "kaicardenas0618/subway-builder-peru@1.1.0/iqt.zip": 1,
    "kaicardenas0618/subway-builder-peru@1.1.0/iqt.zip#RA_kwDOStO8Y84Z-jlF": 1,
    "kaicardenas0618/subway-builder-peru@1.1.0/jau.zip": 1,
    "kaicardenas0618/subway-builder-peru@1.1.0/jau.zip#RA_kwDOStO8Y84Z-jlo": 1,
    "kaicardenas0618/subway-builder-peru@1.1.0/lim.zip": 1,
    "kaicardenas0618/subway-builder-peru@1.1.0/lim.zip#RA_kwDOStO8Y84Z-jmM": 1,
    "kaicardenas0618/subway-builder-peru@1.1.0/piu.zip": 1,
    "kaicardenas0618/subway-builder-peru@1.1.0/piu.zip#RA_kwDOStO8Y84Z-jm9": 1,
    "kaicardenas0618/subway-builder-peru@1.1.0/tru.zip": 1,
    "kaicardenas0618/subway-builder-peru@1.1.0/tru.zip#RA_kwDOStO8Y84Z-jn2": 1,
    "seanyushoumori/track-visualizer@v1.1.0/track-visualizer-v1.1.0.zip#RA_kwDOStcxy84Z9y3Y": 1
  }
}
