{
  "schema_version": 1,
  "snapshot_date": "2026_08_13",
  "generated_at": "2026-08-13T04:03:02.334Z",
  "source_ledger_updated_at": "2026-08-13T02:52:48.697Z",
  "total_attributed_fetches": 14252,
  "net_attributed_fetches": 1061,
  "daily_attributed_fetches": 105,
  "assets_daily": {
    "ahkimn/subwaybuilder-jp-maps@0.4.12/akj.zip": 1,
    "ahkimn/subwaybuilder-jp-maps@0.4.12/akj.zip#RA_kwDORgfqUM4eiEhR": 1,
    "ahkimn/subwaybuilder-jp-maps@0.4.12/aoj.zip": 1,
    "ahkimn/subwaybuilder-jp-maps@0.4.12/aoj.zip#RA_kwDORgfqUM4eiEmV": 1,
    "ahkimn/subwaybuilder-jp-maps@0.4.12/axt.zip": 1,
    "ahkimn/subwaybuilder-jp-maps@0.4.12/axt.zip#RA_kwDORgfqUM4eiEso": 1,
    "ahkimn/subwaybuilder-jp-maps@0.4.12/fjn.zip": 1,
    "ahkimn/subwaybuilder-jp-maps@0.4.12/fjn.zip#RA_kwDORgfqUM4eiE6R": 1,
    "ahkimn/subwaybuilder-jp-maps@0.4.12/fkj.zip": 1,
    "ahkimn/subwaybuilder-jp-maps@0.4.12/fkj.zip#RA_kwDORgfqUM4eiFDu": 1,
    "ahkimn/subwaybuilder-jp-maps@0.4.12/fks.zip": 1,
    "ahkimn/subwaybuilder-jp-maps@0.4.12/fks.zip#RA_kwDORgfqUM4eiFHm": 1,
    "ahkimn/subwaybuilder-jp-maps@0.4.12/fokk.zip": 1,
    "ahkimn/subwaybuilder-jp-maps@0.4.12/fokk.zip#RA_kwDORgfqUM4eiFUf": 1,
    "ahkimn/subwaybuilder-jp-maps@0.4.12/fsz.zip": 1,
    "ahkimn/subwaybuilder-jp-maps@0.4.12/fsz.zip#RA_kwDORgfqUM4eiFlK": 1,
    "ahkimn/subwaybuilder-jp-maps@0.4.12/fuk.zip": 1,
    "ahkimn/subwaybuilder-jp-maps@0.4.12/fuk.zip#RA_kwDORgfqUM4eiFx_": 1,
    "ahkimn/subwaybuilder-jp-maps@0.4.12/gaj.zip": 1,
    "ahkimn/subwaybuilder-jp-maps@0.4.12/gaj.zip#RA_kwDORgfqUM4eiF4z": 1,
    "ahkimn/subwaybuilder-jp-maps@0.4.12/hhe.zip": 1,
    "ahkimn/subwaybuilder-jp-maps@0.4.12/hhe.zip#RA_kwDORgfqUM4eiF9-": 1,
    "ahkimn/subwaybuilder-jp-maps@0.4.12/hij.zip": 1,
    "ahkimn/subwaybuilder-jp-maps@0.4.12/hij.zip#RA_kwDORgfqUM4eiGDd": 1,
    "ahkimn/subwaybuilder-jp-maps@0.4.12/hkd.zip": 1,
    "ahkimn/subwaybuilder-jp-maps@0.4.12/hkd.zip#RA_kwDORgfqUM4eiGOo": 1,
    "ahkimn/subwaybuilder-jp-maps@0.4.12/hna.zip": 1,
    "ahkimn/subwaybuilder-jp-maps@0.4.12/hna.zip#RA_kwDORgfqUM4eiGSj": 1,
    "ahkimn/subwaybuilder-jp-maps@0.4.12/hnd.zip": 1,
    "ahkimn/subwaybuilder-jp-maps@0.4.12/hnd.zip#RA_kwDORgfqUM4eiGcp": 1,
    "ahkimn/subwaybuilder-jp-maps@0.4.12/itm.zip": 1,
    "ahkimn/subwaybuilder-jp-maps@0.4.12/itm.zip#RA_kwDORgfqUM4eiHUL": 1,
    "ahkimn/subwaybuilder-jp-maps@0.4.12/izo.zip": 1,
    "ahkimn/subwaybuilder-jp-maps@0.4.12/izo.zip#RA_kwDORgfqUM4eiHlZ": 1,
    "ahkimn/subwaybuilder-jp-maps@0.4.12/kcz.zip": 1,
    "ahkimn/subwaybuilder-jp-maps@0.4.12/kcz.zip#RA_kwDORgfqUM4eiHtc": 1,
    "ahkimn/subwaybuilder-jp-maps@0.4.12/kfu.zip": 1,
    "ahkimn/subwaybuilder-jp-maps@0.4.12/kfu.zip#RA_kwDORgfqUM4eiHx6": 1,
    "ahkimn/subwaybuilder-jp-maps@0.4.12/khs.zip": 1,
    "ahkimn/subwaybuilder-jp-maps@0.4.12/khs.zip#RA_kwDORgfqUM4eiH42": 1,
    "ahkimn/subwaybuilder-jp-maps@0.4.12/kij.zip": 1,
    "ahkimn/subwaybuilder-jp-maps@0.4.12/kij.zip#RA_kwDORgfqUM4eiISN": 1,
    "ahkimn/subwaybuilder-jp-maps@0.4.12/kkj.zip": 1,
    "ahkimn/subwaybuilder-jp-maps@0.4.12/kkj.zip#RA_kwDORgfqUM4eiIby": 1,
    "ahkimn/subwaybuilder-jp-maps@0.4.12/kmi.zip": 1,
    "ahkimn/subwaybuilder-jp-maps@0.4.12/kmi.zip#RA_kwDORgfqUM4eiIg8": 1,
    "ahkimn/subwaybuilder-jp-maps@0.4.12/kmj.zip": 1,
    "ahkimn/subwaybuilder-jp-maps@0.4.12/kmj.zip#RA_kwDORgfqUM4eiIli": 1,
    "ahkimn/subwaybuilder-jp-maps@0.4.12/kmq.zip": 1,
    "ahkimn/subwaybuilder-jp-maps@0.4.12/kmq.zip#RA_kwDORgfqUM4eiIxp": 1,
    "ahkimn/subwaybuilder-jp-maps@0.4.12/koj.zip": 1,
    "ahkimn/subwaybuilder-jp-maps@0.4.12/koj.zip#RA_kwDORgfqUM4eiI5f": 1,
    "ahkimn/subwaybuilder-jp-maps@0.4.12/mbs.zip": 1,
    "ahkimn/subwaybuilder-jp-maps@0.4.12/mbs.zip#RA_kwDORgfqUM4eiJEu": 1,
    "ahkimn/subwaybuilder-jp-maps@0.4.12/mmj.zip": 1,
    "ahkimn/subwaybuilder-jp-maps@0.4.12/mmj.zip#RA_kwDORgfqUM4eiJWs": 1,
    "ahkimn/subwaybuilder-jp-maps@0.4.12/myj.zip": 1,
    "ahkimn/subwaybuilder-jp-maps@0.4.12/myj.zip#RA_kwDORgfqUM4eiJeT": 1,
    "ahkimn/subwaybuilder-jp-maps@0.4.12/ngo.zip": 1,
    "ahkimn/subwaybuilder-jp-maps@0.4.12/ngo.zip#RA_kwDORgfqUM4eiJm1": 1,
    "ahkimn/subwaybuilder-jp-maps@0.4.12/ngs.zip": 1,
    "ahkimn/subwaybuilder-jp-maps@0.4.12/ngs.zip#RA_kwDORgfqUM4eiJ9u": 1,
    "ahkimn/subwaybuilder-jp-maps@0.4.12/oit.zip": 1,
    "ahkimn/subwaybuilder-jp-maps@0.4.12/oit.zip#RA_kwDORgfqUM4eiKEo": 1,
    "ahkimn/subwaybuilder-jp-maps@0.4.12/oka.zip": 1,
    "ahkimn/subwaybuilder-jp-maps@0.4.12/oka.zip#RA_kwDORgfqUM4eiKNZ": 1,
    "ahkimn/subwaybuilder-jp-maps@0.4.12/okj.zip": 1,
    "ahkimn/subwaybuilder-jp-maps@0.4.12/okj.zip#RA_kwDORgfqUM4eiKSJ": 1,
    "ahkimn/subwaybuilder-jp-maps@0.4.12/qfy.zip": 1,
    "ahkimn/subwaybuilder-jp-maps@0.4.12/qfy.zip#RA_kwDORgfqUM4eiKgR": 1,
    "ahkimn/subwaybuilder-jp-maps@0.4.12/qis.zip": 1,
    "ahkimn/subwaybuilder-jp-maps@0.4.12/qis.zip#RA_kwDORgfqUM4eiKo2": 1,
    "ahkimn/subwaybuilder-jp-maps@0.4.12/qng.zip": 1,
    "ahkimn/subwaybuilder-jp-maps@0.4.12/qng.zip#RA_kwDORgfqUM4eiKx3": 1,
    "ahkimn/subwaybuilder-jp-maps@0.4.12/qut.zip": 1,
    "ahkimn/subwaybuilder-jp-maps@0.4.12/qut.zip#RA_kwDORgfqUM4eiK6O": 1,
    "ahkimn/subwaybuilder-jp-maps@0.4.12/sdj.zip": 1,
    "ahkimn/subwaybuilder-jp-maps@0.4.12/sdj.zip#RA_kwDORgfqUM4eiLGx": 1,
    "ahkimn/subwaybuilder-jp-maps@0.4.12/shb.zip#RA_kwDORgfqUM4eiLRn": 1,
    "ahkimn/subwaybuilder-jp-maps@0.4.12/spk.zip": 1,
    "ahkimn/subwaybuilder-jp-maps@0.4.12/spk.zip#RA_kwDORgfqUM4eiLUt": 1,
    "ahkimn/subwaybuilder-jp-maps@0.4.12/tak.zip": 1,
    "ahkimn/subwaybuilder-jp-maps@0.4.12/tak.zip#RA_kwDORgfqUM4eiLnC": 1,
    "ahkimn/subwaybuilder-jp-maps@0.4.12/tks.zip": 1,
    "ahkimn/subwaybuilder-jp-maps@0.4.12/tks.zip#RA_kwDORgfqUM4eiLuS": 1,
    "ahkimn/subwaybuilder-jp-maps@0.4.12/toy.zip": 1,
    "ahkimn/subwaybuilder-jp-maps@0.4.12/toy.zip#RA_kwDORgfqUM4eiL3e": 1,
    "ahkimn/subwaybuilder-jp-maps@0.4.12/ttj.zip": 1,
    "ahkimn/subwaybuilder-jp-maps@0.4.12/ttj.zip#RA_kwDORgfqUM4eiMEY": 1,
    "ahkimn/subwaybuilder-jp-maps@0.4.12/ubj.zip": 1,
    "ahkimn/subwaybuilder-jp-maps@0.4.12/ubj.zip#RA_kwDORgfqUM4eiMJv": 1,
    "ahkimn/subwaybuilder-jp-maps@0.4.12/ukb.zip": 1,
    "ahkimn/subwaybuilder-jp-maps@0.4.12/ukb.zip#RA_kwDORgfqUM4eiMS4": 1,
    "ahkimn/subwaybuilder-jp-maps@0.4.12/uky.zip": 1,
    "ahkimn/subwaybuilder-jp-maps@0.4.12/uky.zip#RA_kwDORgfqUM4eiMl9": 1,
    "ahkimn/subwaybuilder-jp-maps@0.4.12/wkj.zip": 1,
    "ahkimn/subwaybuilder-jp-maps@0.4.12/wkj.zip#RA_kwDORgfqUM4eiMzz": 1,
    "ahkimn/subwaybuilder-jp-maps@0.4.12/wky.zip": 1,
    "ahkimn/subwaybuilder-jp-maps@0.4.12/wky.zip#RA_kwDORgfqUM4eiM1s": 1,
    "kronifer/sb-chinese-maps@v1.7.0/can.zip": 1,
    "kronifer/sb-chinese-maps@v1.7.0/ckg.zip": 1,
    "kronifer/sb-chinese-maps@v1.7.0/pek.zip": 1,
    "kronifer/sb-chinese-maps@v1.7.0/sha.zip": 1,
    "kronifer/sb-chinese-maps@v1.7.0/szx.zip": 1,
    "worstboyinaustral1a/subway-builder-za@cpt-1.0.2/cpt_v1.0.2.zip#RA_kwDOTRwM6c4dF0ps": 1
  }
}
