{
  "schema_version": 1,
  "snapshot_date": "2026_08_14",
  "generated_at": "2026-08-14T04:03:09.851Z",
  "source_ledger_updated_at": "2026-08-14T02:58:27.395Z",
  "total_attributed_fetches": 14368,
  "net_attributed_fetches": 116,
  "daily_attributed_fetches": 12,
  "assets_daily": {
    "kronifer/sb-chinese-maps@v1.7.0/can.zip": 2,
    "kronifer/sb-chinese-maps@v1.7.0/ckg.zip": 2,
    "kronifer/sb-chinese-maps@v1.7.0/pek.zip": 2,
    "kronifer/sb-chinese-maps@v1.7.0/sha.zip": 2,
    "kronifer/sb-chinese-maps@v1.7.0/szx.zip": 2,
    "worstboyinaustral1a/subway-builder-za@cpt-1.0.2/cpt_v1.0.2.zip#RA_kwDOTRwM6c4dF0ps": 2
  }
}
