{
  "schema_version": 1,
  "snapshot_date": "2026_07_30",
  "generated_at": "2026-07-30T04:01:43.532Z",
  "source_ledger_updated_at": "2026-07-30T03:35:37.905Z",
  "total_attributed_fetches": 12238,
  "net_attributed_fetches": 76,
  "daily_attributed_fetches": 16,
  "assets_daily": {
    "kronifer/sb-chinese-maps@v1.7.0/can.zip": 2,
    "kronifer/sb-chinese-maps@v1.7.0/ckg.zip": 2,
    "kronifer/sb-chinese-maps@v1.7.0/pek.zip": 2,
    "kronifer/sb-chinese-maps@v1.7.0/sha.zip": 2,
    "kronifer/sb-chinese-maps@v1.7.0/szx.zip": 2,
    "nerdiesanders/subway-builder-gchi@v1.3.0/gchi.zip#RA_kwDOTEOQ_84b8KMm": 2,
    "ryandicicco/subway-builder-maps@v1.2.0-psc/psc.zip": 1,
    "ryandicicco/subway-builder-maps@v1.2.0-psc/psc.zip#RA_kwDORhxqX84deoJe": 1,
    "worstboyinaustral1a/subway-builder-za@cpt-1.0.2/cpt_v1.0.2.zip#RA_kwDOTRwM6c4dF0ps": 2
  }
}
