{
  "schema_version": 1,
  "snapshot_date": "2026_07_15",
  "generated_at": "2026-07-15T04:01:16.009Z",
  "source_ledger_updated_at": "2026-07-15T02:15:46.812Z",
  "total_attributed_fetches": 9789,
  "net_attributed_fetches": 94,
  "daily_attributed_fetches": 16,
  "assets_daily": {
    "cvwh7gzvv9-collab/subway-builder-bordeaux@v1.4.0/bordeaux-arcachon-libourne_v1.4.0.zip#RA_kwDOTYQA5s4ccPX3": 2,
    "kronifer/sb-chinese-maps@v1.7.0/can.zip": 2,
    "kronifer/sb-chinese-maps@v1.7.0/ckg.zip": 2,
    "kronifer/sb-chinese-maps@v1.7.0/pek.zip": 2,
    "kronifer/sb-chinese-maps@v1.7.0/sha.zip": 2,
    "kronifer/sb-chinese-maps@v1.7.0/szx.zip": 2,
    "nerdiesanders/subway-builder-gchi@v1.3.0/gchi.zip#RA_kwDOTEOQ_84b8KMm": 2,
    "worstboyinaustral1a/subway-builder-za@dbn-1.0.0/dbn_v1.0.0.zip#RA_kwDOTRwM6c4cJCRB": 2
  }
}
