{
  "schema_version": 1,
  "snapshot_date": "2026_03_26",
  "generated_at": "2026-03-26T04:00:00.000Z",
  "source_ledger_updated_at": "2026-05-24T02:54:12.621Z",
  "total_attributed_fetches": 3739,
  "net_attributed_fetches": 349,
  "daily_attributed_fetches": 5,
  "assets_daily": {
    "ahkimn/subwaybuilder-jp-maps@0.3.1/itm.zip": 1,
    "danield1909/dantrains@v1.3.0/dantrains-1_3_0-phoenix.zip": 2,
    "kronifer/sb-glasgow-edinburgh-map@v1.0.0/gled.zip": 2
  }
}
