{
  "schema_version": 1,
  "snapshot_date": "2026_03_19",
  "generated_at": "2026-03-19T04:00:00.000Z",
  "source_ledger_updated_at": "2026-05-24T02:54:12.621Z",
  "total_attributed_fetches": 1317,
  "net_attributed_fetches": 370,
  "daily_attributed_fetches": 129,
  "assets_daily": {
    "ahkimn/subwaybuilder-jp-maps@0.1.3/fuk.zip": 1,
    "ahkimn/subwaybuilder-jp-maps@0.1.3/gaj.zip": 1,
    "ahkimn/subwaybuilder-jp-maps@0.1.3/hij.zip": 1,
    "ahkimn/subwaybuilder-jp-maps@0.1.3/kcz.zip": 1,
    "ahkimn/subwaybuilder-jp-maps@0.1.3/kij.zip": 1,
    "ahkimn/subwaybuilder-jp-maps@0.1.3/kkj.zip": 1,
    "ahkimn/subwaybuilder-jp-maps@0.1.3/koj.zip": 1,
    "ahkimn/subwaybuilder-jp-maps@0.1.3/myj.zip": 1,
    "ahkimn/subwaybuilder-jp-maps@0.1.3/oka.zip": 1,
    "ahkimn/subwaybuilder-jp-maps@0.1.3/sdj.zip": 1,
    "ahkimn/subwaybuilder-jp-maps@0.1.3/spk.zip": 1,
    "ahkimn/subwaybuilder-jp-maps@0.1.3/ukb.zip": 1,
    "ahkimn/subwaybuilder-jp-maps@0.1.3/uky.zip": 1,
    "ahkimn/subwaybuilder-jp-maps@0.2.0/fuk.zip": 1,
    "ahkimn/subwaybuilder-jp-maps@0.2.0/gaj.zip": 1,
    "ahkimn/subwaybuilder-jp-maps@0.2.0/hij.zip": 1,
    "ahkimn/subwaybuilder-jp-maps@0.2.0/hkd.zip": 1,
    "ahkimn/subwaybuilder-jp-maps@0.2.0/izo.zip": 1,
    "ahkimn/subwaybuilder-jp-maps@0.2.0/kcz.zip": 1,
    "ahkimn/subwaybuilder-jp-maps@0.2.0/kij.zip": 1,
    "ahkimn/subwaybuilder-jp-maps@0.2.0/kkj.zip": 1,
    "ahkimn/subwaybuilder-jp-maps@0.2.0/koj.zip": 1,
    "ahkimn/subwaybuilder-jp-maps@0.2.0/myj.zip": 1,
    "ahkimn/subwaybuilder-jp-maps@0.2.0/ngs.zip": 1,
    "ahkimn/subwaybuilder-jp-maps@0.2.0/oka.zip": 1,
    "ahkimn/subwaybuilder-jp-maps@0.2.0/sdj.zip": 1,
    "ahkimn/subwaybuilder-jp-maps@0.2.0/spk.zip": 1,
    "ahkimn/subwaybuilder-jp-maps@0.2.0/tak.zip": 1,
    "ahkimn/subwaybuilder-jp-maps@0.2.0/toy.zip": 1,
    "ahkimn/subwaybuilder-jp-maps@0.2.0/ukb.zip": 1,
    "ahkimn/subwaybuilder-jp-maps@0.2.0/uky.zip": 1,
    "ahkimn/subwaybuilder-regions@v0.4.5/subwaybuilder-regions-v0.4.5.zip": 1,
    "barkuperman/jerusalem-sb-map@v0.2.0/jlm.zip": 1,
    "barkuperman/jerusalem-sb-map@v0.3.0/jlm.zip": 1,
    "barkuperman/jerusalem-sb-map@v0.3.1/jer.zip": 1,
    "barkuperman/tlv-mod@v1.2.0/tlv.v1.2.zip": 1,
    "barkuperman/tlv-mod@v1.3.0/tlv.zip": 1,
    "barkuperman/tlv-mod@v2.0.0/tlv.zip": 1,
    "barkuperman/transit-overlay-subway-builder-mod@1.5.0/transit-overlay.zip": 1,
    "crumpetime/sb-maps-hkg@0.3.0/hkg.zip": 1,
    "crumpetime/sb-maps-hkg@0.4.0/hkg.zip": 1,
    "crumpetime/sb-maps-msn@3.0.0/msn.zip": 1,
    "crumpetime/sb-maps-orf@1.0.0/orf.zip": 1,
    "crumpetime/sb-maps-xna@1.0.0/xna.zip": 1,
    "crumpetime/subway_builder_distance_circles@0.3.3/distancecircles.zip": 1,
    "danield1909/dantrains@v1.0.0/dantrains-1_0_0-phoenix.zip": 1,
    "danield1909/dantrains@v1.0.1/dantrains-1_0_1-phoenix.zip": 1,
    "danield1909/dantrains@v1.0.2/dantrains-1_0_2-phoenix.zip": 1,
    "danield1909/dantrains@v1.0.3/dantrains-1_0_3-phoenix.zip": 1,
    "danield1909/dantrains@v1.1.0/dantrains-1_1_0-phoenix.zip": 1,
    "danield1909/dantrains@v1.1.1/dantrains-1_1_1-phoenix.zip": 1,
    "danield1909/improvedtwincities@v1.0.0/kmsp.zip": 1,
    "devenperez/subway-builder-canadian-maps@v1.0.1/cgy.zip": 1,
    "devenperez/subway-builder-canadian-maps@v1.0.1/edm.zip": 1,
    "devenperez/subway-builder-canadian-maps@v1.0.1/mon.zip": 1,
    "devenperez/subway-builder-canadian-maps@v1.0.1/ott.zip": 1,
    "devenperez/subway-builder-canadian-maps@v1.0.1/qc.zip": 1,
    "devenperez/subway-builder-canadian-maps@v1.0.1/tor.zip": 1,
    "devenperez/subway-builder-canadian-maps@v1.0.1/van.zip": 1,
    "devenperez/subway-builder-canadian-maps@v1.0.1/wpg.zip": 1,
    "devenperez/subway-builder-canadian-maps@v1.1.3/yeg.zip": 1,
    "devenperez/subway-builder-canadian-maps@v1.1.3/yow.zip": 1,
    "devenperez/subway-builder-canadian-maps@v1.1.3/yqb.zip": 1,
    "devenperez/subway-builder-canadian-maps@v1.1.3/yul.zip": 1,
    "devenperez/subway-builder-canadian-maps@v1.1.3/yvr.zip": 1,
    "devenperez/subway-builder-canadian-maps@v1.1.3/ywg.zip": 1,
    "devenperez/subway-builder-canadian-maps@v1.1.3/yyc.zip": 1,
    "devenperez/subway-builder-canadian-maps@v1.1.3/yyz.zip": 1,
    "gio1112/subway-builder-citymapper@0.1.0/citymapper.zip": 1,
    "gio1112/subway-builder-citymapper@0.1.2/citymapper.zip": 1,
    "kronifer/sb-dublin-map@v1.0.0/dublin.zip": 1,
    "kronifer/sb-dublin-map@v1.1.0/dub.zip": 1,
    "kronifer/sb-waterloo-map@1.0.0/ykf.zip": 1,
    "kronifer/sb-waterloo-map@1.0.1/ykf.zip": 1,
    "kronifer/sb-waterloo-map@1.1.0/ykf.zip": 1,
    "kronifer/sb-zurich-map@v1.0.0/zrh.zip": 1,
    "kronifer/sb-zurich-map@v1.1.0/zrh.zip": 1,
    "maximilian284/subwaybuilder-it-maps@1.0.0/bol.zip": 1,
    "maximilian284/subwaybuilder-it-maps@1.0.0/fir.zip": 1,
    "maximilian284/subwaybuilder-it-maps@1.0.0/pal.zip": 1,
    "maximilian284/subwaybuilder-it-maps@1.0.0/rom.zip": 1,
    "maximilian284/subwaybuilder-it-maps@1.0.0/tor.zip": 1,
    "maximilian284/subwaybuilder-it-maps@1.1.0/bar.zip": 1,
    "maximilian284/subwaybuilder-it-maps@1.1.0/cat.zip": 1,
    "maximilian284/subwaybuilder-it-maps@1.1.0/gen.zip": 1,
    "maximilian284/subwaybuilder-it-maps@1.1.0/mil.zip": 1,
    "maximilian284/subwaybuilder-it-maps@1.1.0/nap.zip": 1,
    "maximilian284/subwaybuilder-it-maps@1.2.0/grd.zip": 1,
    "maximilian284/subwaybuilder-it-maps@1.2.0/riv.zip": 1,
    "nzh0172/sb-anymoney@v0.1.0/v0.1.0.zip": 1,
    "nzh0172/sb-malaysia-map-pack@v1.0.0/kul.zip": 1,
    "rslurry/subwaybuilder-maps@1.1.0/bwi.zip": 1,
    "rslurry/subwaybuilder-maps@1.1.0/dca.zip": 1,
    "rslurry/subwaybuilder-maps@1.1.0/jax.zip": 1,
    "rslurry/subwaybuilder-maps@1.1.0/knox.zip": 1,
    "rslurry/subwaybuilder-maps@1.1.0/lax.zip": 1,
    "rslurry/subwaybuilder-maps@1.1.0/laxm.zip": 1,
    "rslurry/subwaybuilder-maps@1.1.0/mco.zip": 1,
    "rslurry/subwaybuilder-maps@1.1.0/mem.zip": 1,
    "rslurry/subwaybuilder-maps@1.1.0/oc.zip": 1,
    "rslurry/subwaybuilder-maps@1.1.0/pr.zip": 1,
    "rslurry/subwaybuilder-maps@1.1.0/ric.zip": 1,
    "rslurry/subwaybuilder-maps@1.1.0/roc.zip": 1,
    "rslurry/subwaybuilder-maps@1.1.0/sat.zip": 1,
    "rslurry/subwaybuilder-maps@1.1.0/sba.zip": 1,
    "rslurry/subwaybuilder-maps@1.1.0/tpa.zip": 1,
    "ryandicicco/subway-builder-maps@v1.0.0/ams.zip": 1,
    "ryandicicco/subway-builder-maps@v1.0.1/rtm.zip": 1,
    "ryandicicco/subway-builder-maps@v1.1.0/ams_v101.zip": 1,
    "ryandicicco/subway-builder-maps@v1.2.0/ams_v120_full.zip": 1,
    "soccerjonj/albany@1.0.0/albany-railway.zip": 1,
    "soccerjonj/colorado-ski-country@1.0.0/colorado-ski-country-railway.zip": 1,
    "soccerjonj/louisville@1.0.0/louisville-railyard.zip": 1,
    "soccerjonj/nashville@2.0.0/nashville-railway.zip": 1,
    "soccerjonj/providence@1.0.0/providence-railyard.zip": 1,
    "soccerjonj/sacramento@1.0.0/sacramento-railyard.zip": 1,
    "stefanorigano/advanced_analytics@v0.9.1/advanced_analytics-v0.9.1.zip": 1,
    "stefanorigano/advanced_analytics@v0.9.2/advanced_analytics-v0.9.2.zip": 1,
    "stefanorigano/advanced_analytics@v1.0.0/advanced_analytics-v1.0.0.zip": 1,
    "stefanorigano/advanced_analytics@v1.0.1/advanced_analytics-v1.0.1.zip": 1,
    "stefanorigano/advanced_analytics@v1.1.0/advanced_analytics-v1.1.0.zip": 1,
    "stefanorigano/advanced_analytics@v1.2.0/advanced_analytics-v1.2.0.zip": 1,
    "stefanorigano/advanced_analytics@v1.2.1/advanced_analytics-v1.2.1.zip": 1,
    "valdotorium/railyard-maps-2@v0.1.1/ber.zip": 1,
    "valdotorium/railyard-maps-2@v0.1.1/sin.zip": 1,
    "valdotorium/railyard-maps-2@v0.1.1/trd.zip": 1,
    "valdotorium/railyard-maps-2@v0.1.1/waw.zip": 1,
    "valdotorium/valdotoriums_trains@v0.1.2/valdotoriums_trains_0_1_2.zip": 1,
    "valdotorium/valdotoriums_trains@v0.1.3/valdotoriums_trains_0_1_3.zip": 1
  }
}
