{
  "schema_version": 1,
  "snapshot_date": "2026_04_17",
  "generated_at": "2026-04-17T04:00:00.000Z",
  "source_ledger_updated_at": "2026-05-24T02:54:12.621Z",
  "total_attributed_fetches": 5707,
  "net_attributed_fetches": 11,
  "daily_attributed_fetches": 6,
  "assets_daily": {
    "crumpetime/sb-maps-rdu@1.0.0/rdu.zip#RA_kwDOSE1j2s4XvDfO": 2,
    "rslurry/subwaybuilder-maps@1.1.6/lax.zip": 1,
    "rslurry/subwaybuilder-maps@1.1.6/lax.zip#RA_kwDORbjJtM4XvJoP": 1,
    "rslurry/subwaybuilder-maps@1.1.6/laxm.zip": 1,
    "rslurry/subwaybuilder-maps@1.1.6/laxm.zip#RA_kwDORbjJtM4XvTTD": 1
  }
}
