{
  "schema_version": 1,
  "snapshot_date": "2026_04_11",
  "generated_at": "2026-04-11T04:00:00.000Z",
  "source_ledger_updated_at": "2026-05-24T02:54:12.621Z",
  "total_attributed_fetches": 5540,
  "net_attributed_fetches": 284,
  "daily_attributed_fetches": 2,
  "assets_daily": {
    "barkuperman/jerusalem-sb-map@v0.3.2/jer.zip#RA_kwDORfHNf84Xd0qb": 2
  }
}
