{
  "schema_version": 1,
  "snapshot_date": "2026_05_29",
  "generated_at": "2026-05-29T04:54:41.099Z",
  "source_ledger_updated_at": "2026-05-29T04:15:12.226Z",
  "total_attributed_fetches": 6743,
  "net_attributed_fetches": 6,
  "daily_attributed_fetches": 1,
  "assets_daily": {
    "kaicardenas0618/chinese-trains@v1.2.0/chinese-trains-v1.2.0.zip#RA_kwDOSao1YM4ZyaJt": 1
  }
}
