{
  "schema_version": 1,
  "snapshot_date": "2026_04_13",
  "generated_at": "2026-04-13T04:00:00.000Z",
  "source_ledger_updated_at": "2026-05-24T02:54:12.621Z",
  "total_attributed_fetches": 5616,
  "net_attributed_fetches": 56,
  "daily_attributed_fetches": 5,
  "assets_daily": {
    "kimth9/sb_korean_map_pack@v0.1.0/pus3.zip": 1,
    "kimth9/sb_korean_map_pack@v0.1.0/pus3.zip#RA_kwDOR_rTx84XfvFq": 1,
    "phineapoo/willamette-valley-or@1.0.0/wmv.zip#RA_kwDOR-s6M84Xi7Kf": 2,
    "transitcore/cinematic-camera@v1.2.1/cinematic-camera.v1.2.1.zip#RA_kwDORqcbVc4XiXvQ": 1
  }
}
