{
  "schema_version": 1,
  "snapshot_date": "2026_08_23",
  "generated_at": "2026-08-23T04:02:33.261Z",
  "source_ledger_updated_at": "2026-08-23T02:07:31.988Z",
  "total_attributed_fetches": 15243,
  "net_attributed_fetches": 77,
  "daily_attributed_fetches": 16,
  "assets_daily": {
    "pierreggt/subwaybuilder-maps-france@bsl-v1.0.0/eurodistrictbale_v1.0.0.zip": 1,
    "pierreggt/subwaybuilder-maps-france@bsl-v1.0.0/eurodistrictbale_v1.0.0.zip#RA_kwDOT9zLsc4fLOzJ": 1,
    "pierreggt/subwaybuilder-maps-france@cay-v1.0.0/guyane_v1.0.0.zip": 1,
    "pierreggt/subwaybuilder-maps-france@cay-v1.0.0/guyane_v1.0.0.zip#RA_kwDOT9zLsc4fKkmx": 1,
    "pierreggt/subwaybuilder-maps-france@gva-v1.0.0/grandgeneve_v1.0.0.zip": 1,
    "pierreggt/subwaybuilder-maps-france@gva-v1.0.0/grandgeneve_v1.0.0.zip#RA_kwDOT9zLsc4fKmg0": 1,
    "pierreggt/subwaybuilder-maps-france@ptp-v1.0.0/guadeloupe_v1.0.0.zip": 1,
    "pierreggt/subwaybuilder-maps-france@ptp-v1.0.0/guadeloupe_v1.0.0.zip#RA_kwDOT9zLsc4fKkdl": 1,
    "pierreggt/subwaybuilder-maps-france@pyb-v1.0.0/paysbasque_v1.0.0.zip": 1,
    "pierreggt/subwaybuilder-maps-france@pyb-v1.0.0/paysbasque_v1.0.0.zip#RA_kwDOT9zLsc4fQ0bq": 1,
    "pierreggt/subwaybuilder-maps-france@str-v1.0.3/strasbourg_v1.0.3.zip": 1,
    "pierreggt/subwaybuilder-maps-france@str-v1.0.3/strasbourg_v1.0.3.zip#RA_kwDOT9zLsc4fUrow": 1,
    "pierreggt/subwaybuilder-maps-france@tls-v1.0.1/toulouse_v1.0.1.zip": 1,
    "pierreggt/subwaybuilder-maps-france@tls-v1.0.1/toulouse_v1.0.1.zip#RA_kwDOT9zLsc4fUz_f": 1,
    "worstboyinaustral1a/subway-builder-za@cpt-1.0.2/cpt_v1.0.2.zip#RA_kwDOTRwM6c4dF0ps": 2
  }
}
