{
  "schema_version": 1,
  "snapshot_date": "2026_07_27",
  "generated_at": "2026-07-27T04:01:17.008Z",
  "source_ledger_updated_at": "2026-07-27T00:09:44.772Z",
  "total_attributed_fetches": 11315,
  "net_attributed_fetches": 112,
  "daily_attributed_fetches": 8,
  "assets_daily": {
    "imb11/move-it@v1.2.0/subway-builder-move-it-1.2.0.zip#RA_kwDOTcfkyc4dQAMm": 1,
    "kronifer/sb-chinese-maps@v1.7.0/can.zip": 1,
    "kronifer/sb-chinese-maps@v1.7.0/ckg.zip": 1,
    "kronifer/sb-chinese-maps@v1.7.0/pek.zip": 1,
    "kronifer/sb-chinese-maps@v1.7.0/sha.zip": 1,
    "kronifer/sb-chinese-maps@v1.7.0/szx.zip": 1,
    "nerdiesanders/subway-builder-gchi@v1.3.0/gchi.zip#RA_kwDOTEOQ_84b8KMm": 1,
    "worstboyinaustral1a/subway-builder-za@cpt-1.0.2/cpt_v1.0.2.zip#RA_kwDOTRwM6c4dF0ps": 1
  }
}
