{
  "schema_version": 1,
  "snapshot_date": "2026_07_13",
  "generated_at": "2026-07-13T04:02:08.291Z",
  "source_ledger_updated_at": "2026-07-13T02:24:32.036Z",
  "total_attributed_fetches": 9599,
  "net_attributed_fetches": 105,
  "daily_attributed_fetches": 34,
  "assets_daily": {
    "ahkimn/subwaybuilder-jp-maps@0.4.3/gaj.zip": 1,
    "ahkimn/subwaybuilder-jp-maps@0.4.3/gaj.zip#RA_kwDORgfqUM4cTtMr": 1,
    "ahkimn/subwaybuilder-jp-maps@0.4.3/khs.zip": 1,
    "ahkimn/subwaybuilder-jp-maps@0.4.3/khs.zip#RA_kwDORgfqUM4cTtRv": 1,
    "ahkimn/subwaybuilder-jp-maps@0.4.3/kij.zip": 1,
    "ahkimn/subwaybuilder-jp-maps@0.4.3/kij.zip#RA_kwDORgfqUM4cTt3a": 1,
    "ahkimn/subwaybuilder-jp-maps@0.4.3/sdj.zip": 1,
    "ahkimn/subwaybuilder-jp-maps@0.4.3/sdj.zip#RA_kwDORgfqUM4cTuFl": 1,
    "ahkimn/subwaybuilder-jp-maps@0.4.3/toy.zip": 1,
    "ahkimn/subwaybuilder-jp-maps@0.4.3/toy.zip#RA_kwDORgfqUM4cTuNM": 1,
    "ahkimn/subwaybuilder-jp-maps@0.4.3/ukb.zip": 1,
    "ahkimn/subwaybuilder-jp-maps@0.4.3/ukb.zip#RA_kwDORgfqUM4cTuYw": 1,
    "kronifer/sb-chinese-maps@v1.7.0/can.zip": 3,
    "kronifer/sb-chinese-maps@v1.7.0/ckg.zip": 3,
    "kronifer/sb-chinese-maps@v1.7.0/pek.zip": 3,
    "kronifer/sb-chinese-maps@v1.7.0/sha.zip": 3,
    "kronifer/sb-chinese-maps@v1.7.0/szx.zip": 3,
    "nerdiesanders/subway-builder-gchi@v1.3.0/gchi.zip#RA_kwDOTEOQ_84b8KMm": 3,
    "nzh0172/sb-hideandseek@v1.0.0/sb-hideandseek-v.1.0.0.zip#RA_kwDOTRGCeM4cRcTh": 1,
    "worstboyinaustral1a/subway-builder-za@dbn-1.0.0/dbn_v1.0.0.zip#RA_kwDOTRwM6c4cJCRB": 3
  }
}
