{
  "schema_version": 1,
  "snapshot_date": "2026_09_25",
  "generated_at": "2026-09-25T04:03:04.365Z",
  "source_ledger_updated_at": "2026-09-25T00:06:44.342Z",
  "total_attributed_fetches": 21918,
  "net_attributed_fetches": 12,
  "daily_attributed_fetches": 3,
  "assets_daily": {
    "hernang87/amba-buenos-aires-metropolitan-area-for-subway-builder@v0.3.2/amba.zip#RA_kwDOTcphy84i_hDo": 2,
    "worstboyinaustral1a/subway-builder-za@cpt-1.0.2/cpt_v1.0.2.zip#RA_kwDOTRwM6c4dF0ps": 1
  }
}
