{
  "schema_version": 1,
  "snapshot_date": "2026_04_15",
  "generated_at": "2026-04-15T04:00:00.000Z",
  "source_ledger_updated_at": "2026-05-24T02:54:12.621Z",
  "total_attributed_fetches": 5668,
  "net_attributed_fetches": 6,
  "daily_attributed_fetches": 2,
  "assets_daily": {
    "rslurry/subwaybuilder-maps@1.1.5/slw.zip": 1,
    "rslurry/subwaybuilder-maps@1.1.5/slw.zip#RA_kwDORbjJtM4XpWBI": 1
  }
}
